{
  "decision": "approve",
  "confidence": 0.96,
  "reasoning": "The article is accurate, complete, and safe. It explains Kubernetes networking concepts correctly and includes references.",
  "policy_violations": [],
  "recommendations": [
    "Keep references current as the Kubernetes networking docs evolve."
  ]
}
