{
  "decision": "approve",
  "confidence": 0.79,
  "reasoning": "The article provides accurate and practical guidance on database connection pooling. However, the claim that pooling 'reduces average query latency by 60-70%' is presented without a source or qualifying context. The number may be reasonable for certain workloads but is not universally applicable.",
  "policy_violations": [
    {
      "rule_id": "ACCURACY-004",
      "description": "The article claims connection pooling 'reduces average query latency by 60-70%' without citing a source, benchmark, or qualifying the workload characteristics under which this figure applies.",
      "severity": "minor"
    }
  ],
  "recommendations": [
    "Add a citation or qualify the 60-70% claim with the workload characteristics (e.g., short-lived queries, high connection churn) under which this improvement is observed."
  ]
}
