{
  "decision": "approve",
  "confidence": 0.91,
  "reasoning": "The article provides practical, well-organized guidance on structured logging. It covers the rationale, key fields, common mistakes, and log level usage with a clear reference table. No policy violations detected.",
  "policy_violations": [],
  "recommendations": []
}
