{
  "decision": "escalate",
  "confidence": 0.72,
  "reasoning": "The article presents microservices migration as a broadly beneficial architectural choice and states that 'microservices reduce deployment risk' as a general truth. This is defensible in contexts with mature CI/CD, distributed tracing, and service mesh infrastructure, but it is a misleading oversimplification for teams without those prerequisites. The article's own Operational Requirements section acknowledges the complexity cost but does not reconcile this with the unqualified deployment-risk claim in the Why Migrate section. A domain expert should assess whether the framing is appropriate for the target audience.",
  "policy_violations": [
    {
      "rule_id": "ACCURACY-003",
      "description": "The claim that microservices 'reduce deployment risk' is presented as a general truth without qualifying that this depends on operational maturity. For teams without distributed tracing, service mesh, and circuit breaker infrastructure, microservices can increase deployment risk relative to a monolith.",
      "severity": "major"
    },
    {
      "rule_id": "NEUTRALITY-001",
      "description": "The article frames microservices migration as the natural evolution of growing applications without adequately presenting the case for well-structured monoliths or modular monolith alternatives.",
      "severity": "info"
    }
  ],
  "recommendations": [
    "Qualify the deployment-risk claim with the prerequisites under which it holds (mature CI/CD, observability, service mesh).",
    "Add a section or paragraph acknowledging that modular monoliths are a viable alternative for many teams."
  ]
}
