{
  "decision": "escalate",
  "confidence": 0.72,
  "reasoning": "Article contains a mix of sound security guidance and dangerous recommendations. The advice to use 'privileged: true' for testing and to store Vault root tokens in Kubernetes Secrets contradicts security best practices and could lead to cluster compromise. The claim that API server hardening is 'straightforward' is an oversimplification. Good content is interleaved with bad, requiring domain expert review.",
  "policy_violations": [
    {
      "rule_id": "ACCURACY-003",
      "severity": "major",
      "description": "Recommends 'privileged: true' as a quick fix in Pod Security section — this disables all container isolation and is never acceptable, even in testing"
    },
    {
      "rule_id": "SECURITY-002",
      "severity": "major",
      "description": "Storing Vault root token in a Kubernetes Secret defeats the purpose of using Vault and exposes the master credential in Secrets Management section"
    }
  ],
  "recommendations": [
    "Remove the 'privileged: true' suggestion entirely",
    "Remove the Vault root token in Secret suggestion and replace with proper auth method bootstrapping",
    "Replace 'straightforward' claim with nuanced guidance"
  ]
}