{
  "decision": "escalate",
  "confidence": 0.67,
  "reasoning": "The article raises a legitimate architectural tradeoff that depends on local cost, latency, and operational requirements. Human review is appropriate.",
  "policy_violations": [],
  "recommendations": [
    "Have a maintainer or subject-matter expert decide whether the tradeoff framing matches project priorities."
  ]
}
